{
  "schema": "mucaro-flagpole-exact-tree-inventory/1.0",
  "source_sha": "b88a19ae1f5000a93d6356cc5803acd93555c76b",
  "tree_sha": "9337aab9945687b686230158d90984d7814d02b2",
  "scope": "complete tracked Git blob tree at exact HEAD",
  "exclusions": [],
  "file_count": 557,
  "classification_counts": {
    "configuration": 6,
    "data": 69,
    "documentation": 55,
    "other": 37,
    "schema": 41,
    "source": 192,
    "test": 144,
    "workflow": 13
  },
  "files": [
    {
      "path": ".env.example",
      "mode": "100644",
      "blob_sha": "09b2fe5f08f86741199202faaf51a12c8bdfc2d5",
      "size": 514,
      "classification": "other"
    },
    {
      "path": ".gitattributes",
      "mode": "100644",
      "blob_sha": "edcda7c4a1c0dedf595aa0c276958abe51ae746c",
      "size": 390,
      "classification": "other"
    },
    {
      "path": ".github/workflows/ci-startup-probe.yml",
      "mode": "100644",
      "blob_sha": "056e0b7a0203755c53a0166f68c1f2d99e9a9dc5",
      "size": 188,
      "classification": "workflow"
    },
    {
      "path": ".github/workflows/ci.yml",
      "mode": "100644",
      "blob_sha": "9d0333ac1cd585c54641e0e3a77bb4dd8495f5f1",
      "size": 7071,
      "classification": "workflow"
    },
    {
      "path": ".github/workflows/coding-review-cert.yml",
      "mode": "100644",
      "blob_sha": "bcecf1cf0b981700ec5c6fdcaf2089c6ca288b2a",
      "size": 1429,
      "classification": "workflow"
    },
    {
      "path": ".github/workflows/macos-app.yml",
      "mode": "100644",
      "blob_sha": "81652ef376aadaf283cdea07b1122d902f632086",
      "size": 3276,
      "classification": "workflow"
    },
    {
      "path": ".github/workflows/ocr-corpus-cert.yml",
      "mode": "100644",
      "blob_sha": "4420127ea2e5de0a0c175cd7d864968d2e81b486",
      "size": 2140,
      "classification": "workflow"
    },
    {
      "path": ".github/workflows/ocr-live-cert.yml",
      "mode": "100644",
      "blob_sha": "db680a5124ed1570bcef7de24d8a01098e5fc6f6",
      "size": 1868,
      "classification": "workflow"
    },
    {
      "path": ".github/workflows/ocr08-structure-cert.yml",
      "mode": "100644",
      "blob_sha": "522346d2e85895eeafb51f35123234ba361096df",
      "size": 2025,
      "classification": "workflow"
    },
    {
      "path": ".github/workflows/one-click-setup.yml",
      "mode": "100644",
      "blob_sha": "b799330afc31fcf41118b14b7ca5f157044367e0",
      "size": 11428,
      "classification": "workflow"
    },
    {
      "path": ".github/workflows/rendered-qa.yml",
      "mode": "100644",
      "blob_sha": "8000e0ba829dad577c63d9028ebc6799a5db0c30",
      "size": 1647,
      "classification": "workflow"
    },
    {
      "path": ".github/workflows/rt09-real-world-cert.yml",
      "mode": "100644",
      "blob_sha": "36b3f543414281dd1c225d657cc889eeb7bd194b",
      "size": 1460,
      "classification": "workflow"
    },
    {
      "path": ".github/workflows/rt10-retrieval-scale-cert.yml",
      "mode": "100644",
      "blob_sha": "842f8006d45ab2929348c98982ffff0c4d9e012f",
      "size": 1873,
      "classification": "workflow"
    },
    {
      "path": ".github/workflows/shadow-qa.yml",
      "mode": "100644",
      "blob_sha": "9f22a1664cc99e2b0bd1f5240accacc10b48a43a",
      "size": 4101,
      "classification": "workflow"
    },
    {
      "path": ".github/workflows/web-render-cert.yml",
      "mode": "100644",
      "blob_sha": "d373af658e626f58ed4895a6df8593b1746c6513",
      "size": 1648,
      "classification": "workflow"
    },
    {
      "path": ".gitignore",
      "mode": "100644",
      "blob_sha": "5058a2e021b7c032bb8435a6936cda9ad204b9e1",
      "size": 599,
      "classification": "configuration"
    },
    {
      "path": ".mucaro/BUILD_CONTRACT_V1.json",
      "mode": "100644",
      "blob_sha": "18be2edd0f26e883540ea40e54b5f7d1dee6d96d",
      "size": 1036,
      "classification": "data"
    },
    {
      "path": ".mucaro/FAILURE_TAXONOMY_V1.json",
      "mode": "100644",
      "blob_sha": "6d520ccdb13fe0a589b4167a945ddffac7a90a1c",
      "size": 938,
      "classification": "data"
    },
    {
      "path": ".mucaro/MUCARO_REPO_MANIFEST_V1.json",
      "mode": "100644",
      "blob_sha": "edc6d1fe8a02918e9fb0ce4b657134186bfe8b2c",
      "size": 968,
      "classification": "data"
    },
    {
      "path": "Makefile",
      "mode": "100644",
      "blob_sha": "26db70dbc55f8943e1286aa19ee6d41955b6c5bc",
      "size": 3125,
      "classification": "other"
    },
    {
      "path": "Mucaro AI.app/Contents/Info.plist",
      "mode": "100644",
      "blob_sha": "38231d0c99120542cc82917f6cb1ca18633e7321",
      "size": 704,
      "classification": "other"
    },
    {
      "path": "Mucaro AI.app/Contents/MacOS/mucaro-ai",
      "mode": "100755",
      "blob_sha": "4a2237f17ac5c4a143e70f527efb91a12111c8b0",
      "size": 222,
      "classification": "other"
    },
    {
      "path": "Mucaro AI.app/Contents/Resources/MucaroAI.icns",
      "mode": "100644",
      "blob_sha": "081353e08791c2639176357df8eed8bb6a65159e",
      "size": 2453453,
      "classification": "other"
    },
    {
      "path": "Mucaro AI.app/Contents/Resources/MucaroAI.png",
      "mode": "100644",
      "blob_sha": "aebad6c177eb292a72d1e63d6525edc9f3087de4",
      "size": 418927,
      "classification": "other"
    },
    {
      "path": "Mucaro AI.cmd",
      "mode": "100644",
      "blob_sha": "85a54b16638c78097a8429fd8bb54c4d6eeb9698",
      "size": 668,
      "classification": "other"
    },
    {
      "path": "Mucaro AI.command",
      "mode": "100755",
      "blob_sha": "bb33d97efe0aac89f3493e6fe1cbae50e7feebc6",
      "size": 375,
      "classification": "other"
    },
    {
      "path": "Mucaro AI.exe",
      "mode": "100755",
      "blob_sha": "d3bff871edd6e57fcf4a6cfff6713c4bae73be73",
      "size": 249856,
      "classification": "other"
    },
    {
      "path": "README.md",
      "mode": "100644",
      "blob_sha": "79a90d85c36a70996853f3de936b90874e9fffd0",
      "size": 23915,
      "classification": "documentation"
    },
    {
      "path": "_architecture/DO_NOT_COPY_LEDGER.md",
      "mode": "100644",
      "blob_sha": "6577e533ca873570540f648a870c892f93dc9138",
      "size": 129,
      "classification": "documentation"
    },
    {
      "path": "_architecture/LICENSE_AUDIT.md",
      "mode": "100644",
      "blob_sha": "5c58de78f172ca732d0cf886191fb4ceddbcaca1",
      "size": 121,
      "classification": "documentation"
    },
    {
      "path": "_architecture/PATTERN_MATRIX.csv",
      "mode": "100644",
      "blob_sha": "ab8d898bbd6fe46aa4058c76011b7a80427c139a",
      "size": 1849,
      "classification": "data"
    },
    {
      "path": "_architecture/REFERENCE_FINDINGS.md",
      "mode": "100644",
      "blob_sha": "70af11f8e68294ce9353d00a74014e7b02174241",
      "size": 3456,
      "classification": "documentation"
    },
    {
      "path": "_architecture/coding_regression_manifest.json",
      "mode": "100644",
      "blob_sha": "17407f38b28eda192114208bddf7c276a45112fc",
      "size": 3941,
      "classification": "data"
    },
    {
      "path": "_architecture/gis_real_corpus_manifest.json",
      "mode": "100644",
      "blob_sha": "d3383b7888b5de0086a60f7340194b5393498cf3",
      "size": 5884,
      "classification": "data"
    },
    {
      "path": "_architecture/gis_v1_control_manifest.json",
      "mode": "100644",
      "blob_sha": "a0219bc8e5ba42d1a1d62ab8785736aa849d765e",
      "size": 6683,
      "classification": "data"
    },
    {
      "path": "_architecture/macos_app_store_security_profile.json",
      "mode": "100644",
      "blob_sha": "7223091a34474706cd4f71200be42d2d72f34d9e",
      "size": 6702,
      "classification": "data"
    },
    {
      "path": "_architecture/mucaro_flagpole_gap_matrix_v1.json",
      "mode": "100644",
      "blob_sha": "1df0880d3f32d7badbc908059df5720c2d74ddff",
      "size": 7341,
      "classification": "data"
    },
    {
      "path": "_architecture/mucaro_flagpole_inventory_v1.json",
      "mode": "100644",
      "blob_sha": "5fd1850cae353a6eda7c004d615a7f88d5849d9a",
      "size": 4480,
      "classification": "data"
    },
    {
      "path": "_architecture/mucaro_flagpole_tool_denominator_v1.json",
      "mode": "100644",
      "blob_sha": "148fc999860dc883cba050bb1a45bd8237b01b96",
      "size": 2973,
      "classification": "data"
    },
    {
      "path": "_architecture/mucaro_flagpole_tree_inventory_v1.json",
      "mode": "100644",
      "blob_sha": "860bbffca9d483776be3f1d141470722135871cf",
      "size": 115519,
      "classification": "data"
    },
    {
      "path": "_architecture/mucaro_flagpole_v1.json",
      "mode": "100644",
      "blob_sha": "65d61a3a760324e90d170f5f572ac2863c63cbdf",
      "size": 6421,
      "classification": "data"
    },
    {
      "path": "_architecture/mucaro_v1_denominator.json",
      "mode": "100644",
      "blob_sha": "8a7be2d17281c05303f2cb7edf43e630a743959d",
      "size": 10948,
      "classification": "data"
    },
    {
      "path": "_architecture/mucaro_v1_denominator_events.json",
      "mode": "100644",
      "blob_sha": "3332e9fcfa3f7bf48da3a676c492930b75cb8913",
      "size": 20614,
      "classification": "data"
    },
    {
      "path": "_architecture/ocr08_structure_benchmark_v1.json",
      "mode": "100644",
      "blob_sha": "d2aecd6adb6b6b39ce3fd1e314c52ad24d70274f",
      "size": 1989,
      "classification": "data"
    },
    {
      "path": "_architecture/ocr_v1_corpus_manifest.json",
      "mode": "100644",
      "blob_sha": "bcdb73eb3bcf9c04b48a2da49e75bbcda9509f4c",
      "size": 3323,
      "classification": "data"
    },
    {
      "path": "_architecture/ocr_v1_representative_corpus.json",
      "mode": "100644",
      "blob_sha": "50fe683007786c0b23aacc5bcccabb5b02f899f2",
      "size": 4894,
      "classification": "data"
    },
    {
      "path": "_architecture/release/acceptance_ledger_v1.json",